"ID","text","sensibile"
"Religion162","I take this opportunity to  thank God for answering my prayers 🙏 of success,  multiple financial deals unto PRINCE  and DORATHY  and I continue to  pray for  greater heights 
#DorathyXDstv
#PrinceXDstvMoments , ",0
"Religion163","neko san pharaohs Genes w ber laurent mariamafalh we cat alex pickle mohand The Allied Powers unanimously Ag r ee’s it did not constitute the basis for any legal claim What the hell are you talking about A Jewish state in Palestine had been fully accepted by the League of Nations but Britain betrayed the Jews amp failed to accomplish it",0
"Religion164","Pray for her and those who use contraception",1
"Religion165","Oh please. This is a very disingenuous take. 
Religion - system of belief and/or worship.
People are the adherents of these belief systems. And there are always going to be extremists and persons who have simply misunderstood the basic tenets of these belief systems. , ",0
"Religion166","There is nothing that I pray more for 🥺",0
"Religion167","Great but what about boys who switches Religion for love perhaps not love jihad .
#lovejihaad , ",0
"Religion168","Jesus would be a liberal Real Christians would be liberal Christianity got morphed into republicanism",0
"Religion169","On behave of my family and Nigeria in general am wishing GEJ a happy 63yrs birthday.I pray that God we keep on protecting u in all u do, in Jesus name..Amen",1
"Religion170","Jesus was Middle Eastern and really the colour of his skin is important why He is the saviour of the world born as a such dying and resurrected in order that we can have the relationship with God that was broken in the garden by sin",1
"Religion171","The bible literally references Ethiopia the kings James is just a translation i swear",0
"Religion172","The #Parable of the #Sheep and #Goats (Matt 25:31-46)
, 
#Bible  #bibleverse #Video #BibleStudy #lectiodivina #Jesus #Faith #Christian #SundayMorning #Believe #JesusChrist #goodworks #BibleVerseForToday #BibleVerses #SundayThoughts #BibleVerses #Christianity",1
"Religion173","The Amaras Cathedral is located in Artsakh (NK). It is a monument of Armenian apostolic church found un 4th century AD by St. Gregory the Enlightener.
#AtrsakhIsArmenia
#StopAzerbaijaniAggression 
#StopAzeriWarCrimes
#PeaceforArmenians , ",0
"Religion174","NOW PLAYING: Faithful Is Our God - Hezekiah Walker » LISTEN NOW at ,  #Live365 #GospelMusic #GospelRadio #BGRLive
 » Get this song: ,  , ",0
"Religion175","Is she Referring Diwali as Khusi and Bakri-Eid as Nafrat?
Such hatred for a Muslim festival won't be accepted 
I condemn this Tweet ! 
Shame! , ",1
"Religion176","Better to just create history or make something out of yourself

No matter how long it takes... Let GOD/JESUS take control

The spirit of the lord—even if we don’t feel or notice god/Jesus will always be in the heart",1
"Religion177","We all with you..may allah bless you  long live🌈
#Impose302InSSRCase , ",1
"Religion178","Muslim hi all will jutify",0
"Religion179","Because Jesus would definitely support someone who defrauded thousands of students who cheated on his wife while pregnant with a porn star who lied to the IRS and banks who increased drone strike in the middle east That s the kind of christian we all should be right",1
"Religion180","I am a firm believer that religion has done more harm to humanity than good Hindus and Muslims can follow their respective religion but I don’t see any reason to compare one with the other",1
"Religion181","Why tweet about someone you don’t believe exist I agree don’t push religion on anyone but also don’t joke around about someones religion",0
"Religion182","“He stands for Christians, He hates abortion”

 You thinking that’s enough to be a Christian? No 😆",1
"Religion183","There s one section in here about definitions Seems like they want to lump atheism in as a belief like all other religious beliefs Unless I ve not read it right",0
"Religion184","It's Day 19 of the Ang Dating Daan Live Mass Indoctrination! 

Let's continue studying the doctrines of the Lord Jesus Christ written in the Holy Scriptures.

Happening at 7 p.m. Philippine Time.

#PureDoctrinesOfChrist",1
"Religion185","Then have a nice sleep unnie Dont forget to pray before falling asleep",0
"Religion186","Lord lead me to follow your path in the Mighty name of Jesus Christ AMEN",1
"Religion187","No because only Muslim sensitivities matter stupid And what about Christian sensitivities toward the blaspheming through the denial of Jesus being the son of God According to Christians Islam is a blasphemy Muslim should be more sensitive to this point 🤦🏻‍♂️",0
"Religion188","The fear of the lord is the beginning of wisdom in all you do or say  either secretly or openly fear God.",0
"Religion189","Lord, You do not change. You are the same mighty, powerful, loving, and merciful God You have always been. Please help me to find hope and rest in the fact that You do not change. Amen. ,  , ",1
"Religion190","Govenor like Christ said in John ch5 31 47 Many catholics or religious are social catholics only They have never seen God face to face or heard his voice So they don t have Gods message in their hearts Because they don t believe in the one God sent",1
"Religion191","No one is neutral Everyone is pushing their views Some have views that they shouldn t push their views which is still pushing their views If this man believes his religion can save another person wouldn t it be wrong not to try to convert others and let them be damned",0
"Religion192","“Possibilities and Impossibilities: God is in Control – not Atheists” Read More: ,  #PureDoctrinesOfChrist",0
"Religion193","People will see God in us by the fruit we bear. 

As Christians, we should be so full of love and light that people are drawn to the Gospel.

Many Christians have forgotten about love. When you seek God’s face, you see how He loves &amp; you begin to love as He loves.",1
"Religion194","What demographic should they be looking out for Priti Terror arrack by who Hindus Buddhists Christians Jews Sikhs Baha’is Shintos Atheists oh wait 🤔",0
"Religion195","KJB Quotes40 InMe Because of the evil spirit of hatred controlling your mind you come up with your own opinions When you should have asked your Loving Father to tell you",1
"Religion196","If these are Christian folks and they expext god to change marks on paper AND the marks do NOT change do they change gods",0
"Religion197","Please y'all help me find Ghana Jesus
I'm John the Baptist I have a prophecy about him",1
"Religion198","(Acts 29:25267)  PRAYING, DEMON RESURRECTING which they learned how to do in the Devil's ""lying"" Church of Christ of Satan witchcraft sorcery EXCLUSIVE WHITE PEOPLE ""cult"" of demon worshipers, invoking conjuring demons in Church out of their complete and total IGNORANCE OF GOD,",1
"Religion199","Close minded catholics will really discriminate how i worship God, come on i worship my own way, just because i don't worship the same as you doesn't mean i'm less of a catholic than it is.",1
"Religion200","I ve noticed nonbelievers can t take those christians seriously who don t wish trump to lose Even they see how immoral his talks and actions are",0
